{
  "artifact": {
    "byte_size": 13752024,
    "path": "educational-sft-v1.json",
    "sha256": "68aaec6ef463cb40f2ce7477fc5d04a7076c5f5163040efa49946e91fd122f30"
  },
  "clinical_validation": {
    "claims_allowed": false,
    "performed": false
  },
  "counts": {
    "label_counts": {
      "deferred": 920,
      "maximum": 1826,
      "moderate": 2254
    },
    "language_counts": {
      "en": 2500,
      "fr": 2500
    },
    "record_count": 5000,
    "risk_family_counts": {
      "chest_pain": 600,
      "contradictory_information": 480,
      "insufficient_information": 560,
      "neurological_deficit": 600,
      "other": 480,
      "pediatric": 560,
      "pregnancy": 560,
      "respiratory_distress": 600,
      "vulnerability": 560
    },
    "split_counts": {
      "test": 500,
      "train": 4000,
      "validation": 500
    }
  },
  "intended_use": "educational_poc_training_only",
  "limits": [
    "Labels are generated by a proposed educational protocol, not clinical review.",
    "Source references provide provenance but scenarios are template-generated.",
    "The dataset is prohibited for patient care or clinical performance claims."
  ],
  "manifest_id": "src-educational-sft-protocol-v1",
  "protocol": {
    "protocol_id": "educational-triage-protocol-v1",
    "sha256": "87b811278459ce6a299481afac71188815e9bc5b6f4265a334b893efbdc39c97",
    "status": "proposed_educational_only"
  },
  "quality": {
    "clinical_review_status_counts": {
      "pending": 5000
    },
    "duplicate_content_count": 0,
    "group_split_leakage": "passed",
    "schema_validation": "passed"
  },
  "schema_version": "1.0.0",
  "source_queue": {
    "path": "sft-authoring-queue-v2.jsonl",
    "record_count": 5000,
    "sha256": "e4ac60c336aeb24dfb602f8e6f4539217f6f751239ac321946322a9ff68bdd9d"
  },
  "status": "approved_for_educational_experiment",
  "transformation": {
    "code_revision": "77ff443",
    "pipeline_name": "educational_sft_generator",
    "pipeline_version": "1.0.0",
    "run_id": "educational-sft-v1-2026-09-03"
  }
}
